Unique Key,Created Date,Closed Date,Agency,Agency Name,Complaint Type,Descriptor,Location Type,Incident Zip,Incident Address,Street Name,Cross Street 1,Cross Street 2,Intersection Street 1,Intersection Street 2,Address Type,City,Landmark,Facility Type,Status,Due Date,Resolution Description,Resolution Action Updated Date,Community Board,BBL,Borough,X Coordinate (State Plane),Y Coordinate (State Plane),Open Data Channel Type,Park Facility Name,Park Borough,Vehicle Type,Taxi Company Borough,Taxi Pick Up Location,Bridge Highway Name,Bridge Highway Direction,Road Ramp,Bridge Highway Segment,Latitude,Longitude,Location,relevant_infraction,preceding_year,preceding_month
16648464,05/12/2010 11:05:00 PM,05/18/2010 11:30:00 PM,DEP,Department of Environmental Protection,Noise,Noise: Construction Before/After Hours (NM1),,11435.0,144-07 JAMAICA AVENUE,JAMAICA AVENUE,144 ST,144 PL,,,ADDRESS,Jamaica,,,Closed,,"The Department of Environmental Protection did not observe a violation of the New York City Air/Noise Code at the time of inspection and could not issue a notice of violation. If the problem still exists, please call 311 and file a new complaint. If you are outside of New York City, please call (212) NEW-YORK (212-639-9675).",05/18/2010 11:30:00 PM,12 QUEENS,4096740048.0,QUEENS,1036596.0,195172.0,UNKNOWN,Unspecified,QUEENS,,,,,,,,40.70222399413133,-73.81121021895018,"(40.70222399413133, -73.81121021895017)",True,False,False
16782134,06/02/2010 04:36:00 PM,06/03/2010 12:00:00 PM,DSNY,Queens East 12,Sanitation Condition,15 Street Cond/Dump-Out/Drop-Off,Street,11435.0,144-07 JAMAICA AVENUE,JAMAICA AVENUE,144 STREET,144 PLACE,,,ADDRESS,JAMAICA,,,Closed,,The Department of Sanitation investigated this complaint and found no condition at the location.,06/03/2010 12:00:00 AM,12 QUEENS,4096740048.0,QUEENS,1036596.0,195172.0,PHONE,Unspecified,QUEENS,,,,,,,,40.70222399413133,-73.81121021895018,"(40.70222399413133, -73.81121021895017)",True,False,False
18640453,09/07/2010 02:30:00 PM,09/09/2010 12:00:00 PM,DSNY,Queens East 12,Sanitation Condition,15 Street Cond/Dump-Out/Drop-Off,Street,11435.0,144-07 JAMAICA AVENUE,JAMAICA AVENUE,144 STREET,144 PLACE,,,ADDRESS,JAMAICA,,,Closed,,The Department of Sanitation investigated this complaint and found no condition at the location.,09/09/2010 12:00:00 AM,12 QUEENS,4096740048.0,QUEENS,1036596.0,195172.0,PHONE,Unspecified,QUEENS,,,,,,,,40.70222399413133,-73.81121021895018,"(40.70222399413133, -73.81121021895017)",True,False,False
16587315,05/04/2010 03:01:48 PM,06/23/2010 12:00:00 AM,DOB,Department of Buildings,General Construction/Plumbing,Cons - Contrary/Beyond Approved Plans/Permits,,11435,144-07 JAMAICA AVENUE,JAMAICA AVENUE,144 STREET,144 PLACE,,,ADDRESS,JAMAICA,,,Closed,,"The Department of Buildings attempted to investigate this complaint twice but could not gain access to the location. If the problem still exists, please call 311 and file a new complaint with additional access information. If you are outside of New York City, please call (212) NEW-YORK (212-639-9675).",06/23/2010 12:00:00 AM,12 QUEENS,4096740048.0,QUEENS,1036596.0,195172.0,UNKNOWN,Unspecified,QUEENS,,,,,,,,40.70222399413133,-73.81121021895018,"(40.70222399413133, -73.81121021895017)",True,False,False
18674749,09/13/2010 01:45:53 PM,09/20/2010 12:00:00 AM,DOB,Department of Buildings,Electrical,Electrical Wiring Defective/Exposed,,11435,144-07 JAMAICA AVENUE,JAMAICA AVENUE,144 STREET,144 PLACE,,,ADDRESS,JAMAICA,,,Closed,,The Department of Buildings investigated this complaint and issued a violation.,09/20/2010 12:00:00 AM,12 QUEENS,4096740048.0,QUEENS,1036596.0,195172.0,UNKNOWN,Unspecified,QUEENS,,,,,,,,40.70222399413133,-73.81121021895018,"(40.70222399413133, -73.81121021895017)",True,False,False
23323453,05/30/2012 10:51:41 PM,05/31/2012 12:24:33 AM,NYPD,New York City Police Department,Noise - Commercial,Loud Music/Party,Club/Bar/Restaurant,11435,144-07 JAMAICA AVENUE,JAMAICA AVENUE,144 STREET,144 PLACE,,,ADDRESS,JAMAICA,,Precinct,Closed,05/31/2012 06:51:41 AM,The Police Department responded to the complaint and took action to fix the condition.,05/31/2012 12:24:33 AM,12 QUEENS,4096740048.0,QUEENS,1036596.0,195172.0,PHONE,Unspecified,QUEENS,,,,,,,,40.70222399413133,-73.81121021895018,"(40.70222399413133, -73.81121021895017)",True,True,True
