Unique Key,Created Date,Closed Date,Agency,Agency Name,Complaint Type,Descriptor,Location Type,Incident Zip,Incident Address,Street Name,Cross Street 1,Cross Street 2,Intersection Street 1,Intersection Street 2,Address Type,City,Landmark,Facility Type,Status,Due Date,Resolution Description,Resolution Action Updated Date,Community Board,BBL,Borough,X Coordinate (State Plane),Y Coordinate (State Plane),Open Data Channel Type,Park Facility Name,Park Borough,Vehicle Type,Taxi Company Borough,Taxi Pick Up Location,Bridge Highway Name,Bridge Highway Direction,Road Ramp,Bridge Highway Segment,Latitude,Longitude,Location,relevant_infraction,preceding_year,preceding_month
22534169,01/17/2012 01:35:00 PM,01/17/2012 03:00:00 PM,DEP,Department of Environmental Protection,Water System,Excessive Water In Basement (WEFB),,10472.0,1590 WESTCHESTER AVENUE,WESTCHESTER AVENUE,MANOR AVE,STRATFORD AVE,,,ADDRESS,BRONX,,,Closed,,The Department of Environmental Protection investigated this complaint and resolved the leak.,01/17/2012 03:00:00 PM,09 BRONX,2037430045.0,BRONX,1018590.0,241368.0,UNKNOWN,Unspecified,BRONX,,,,,,,,40.829108110000895,-73.87591409064883,"(40.8291081100009, -73.87591409064883)",True,False,False
19338240,12/14/2010 02:07:47 PM,01/04/2011 03:31:13 PM,DOT,Department of Transportation,Broken Parking Meter,Coin or Card Did Not Register,Street,10472,1590 WESTCHESTER AVENUE,WESTCHESTER AVENUE,MANOR AVENUE,STRATFORD AVENUE,,,ADDRESS,BRONX,,,Closed,01/03/2011 02:07:47 PM,The Department of Transportation has completed the request or corrected the condition.,01/04/2011 03:31:13 PM,09 BRONX,2037430045.0,BRONX,1018590.0,241368.0,PHONE,Unspecified,BRONX,,,,,,,,40.829108110000895,-73.87591409064883,"(40.8291081100009, -73.87591409064883)",False,False,False
19314634,12/10/2010 02:02:33 PM,12/17/2010 11:20:00 AM,DOT,Department of Transportation,Street Condition,Pothole,,10472,1590 WESTCHESTER AVENUE,WESTCHESTER AVENUE,MANOR AVENUE,STRATFORD AVENUE,,,ADDRESS,BRONX,,,Closed,,The Department of Transportation inspected this complaint and repaired the problem.,12/17/2010 11:20:00 AM,Unspecified BRONX,2037430045.0,BRONX,1018590.0,241368.0,OTHER,Unspecified,BRONX,,,,,,,,40.829108110000895,-73.87591409064883,"(40.8291081100009, -73.87591409064883)",False,False,False
24339620,11/05/2012 09:56:35 AM,12/22/2012 12:01:26 PM,DOT,Department of Transportation,Broken Muni Meter,No Receipt,Street,10472.0,1590 WESTCHESTER AVENUE,WESTCHESTER AVENUE,MANOR AVENUE,STRATFORD AVENUE,,,ADDRESS,BRONX,,,Closed,11/26/2012 09:56:35 AM,The Department of Transportation has completed the request or corrected the condition.,12/22/2012 12:01:26 PM,09 BRONX,2037430045.0,BRONX,1018590.0,241368.0,PHONE,Unspecified,BRONX,,,,,,,,40.829108110000895,-73.87591409064883,"(40.8291081100009, -73.87591409064883)",False,False,False
25165697,03/12/2013 06:58:45 PM,03/15/2013 03:06:24 PM,DOT,Department of Transportation,Broken Muni Meter,Coin or Card Did Not Register,Street,10472,1590 WESTCHESTER AVENUE,WESTCHESTER AVENUE,MANOR AVENUE,STRATFORD AVENUE,,,ADDRESS,BRONX,,,Closed,04/01/2013 06:58:45 PM,"The Department of Transportation inspected the condition you reported. You can find additional information in the ""Notes to Customer"" field.",03/15/2013 03:05:26 PM,09 BRONX,2037430045.0,BRONX,1018590.0,241368.0,PHONE,Unspecified,BRONX,,,,,,,,40.829108110000895,-73.87591409064883,"(40.8291081100009, -73.87591409064883)",False,True,False
26004558,07/28/2013 06:52:33 PM,08/06/2013 11:36:53 AM,DOT,Department of Transportation,Street Condition,Cave-in,Street,10472.0,1590 WESTCHESTER AVENUE,WESTCHESTER AVENUE,MANOR AVENUE,STRATFORD AVENUE,,,ADDRESS,BRONX,,,Closed,08/07/2013 06:52:33 PM,The Department of Transportation inspected the condition you reported and found that the condition meets its standards and/or there is a valid permit to conduct work.,08/06/2013 11:36:04 AM,09 BRONX,2037430045.0,BRONX,1018590.0,241368.0,ONLINE,Unspecified,BRONX,,,,,,,,40.829108110000895,-73.87591409064883,"(40.8291081100009, -73.87591409064883)",False,True,False
