Unique Key,Created Date,Closed Date,Agency,Agency Name,Complaint Type,Descriptor,Location Type,Incident Zip,Incident Address,Street Name,Cross Street 1,Cross Street 2,Intersection Street 1,Intersection Street 2,Address Type,City,Landmark,Facility Type,Status,Due Date,Resolution Description,Resolution Action Updated Date,Community Board,BBL,Borough,X Coordinate (State Plane),Y Coordinate (State Plane),Open Data Channel Type,Park Facility Name,Park Borough,Vehicle Type,Taxi Company Borough,Taxi Pick Up Location,Bridge Highway Name,Bridge Highway Direction,Road Ramp,Bridge Highway Segment,Latitude,Longitude,Location,relevant_infraction,preceding_year,preceding_month
30745575,06/01/2015 01:35:19 PM,,DSNY,Department of Sanitation,Graffiti,Graffiti,Comercial,10027.0,304 LENOX AVENUE,LENOX AVENUE,,,,,ADDRESS,NEW YORK,,,Open,08/14/2015 03:09:43 PM,The graffiti on this property has been scheduled to be removed by the City.,07/15/2015 03:09:43 PM,10 MANHATTAN,1017230001.0,MANHATTAN,999388.0,233653.0,UNKNOWN,Unspecified,MANHATTAN,,,,,,,,40.807986393932744,-73.94531695125801,"(40.80798639393274, -73.94531695125801)",True,False,False
30805105,06/09/2015 05:59:57 PM,,DOHMH,Department of Health and Mental Hygiene,Food Establishment,Bare Hands in Contact w/ Food,Restaurant/Bar/Deli/Bakery,10027,304 LENOX AVENUE,LENOX AVENUE,WEST 125 STREET,WEST 126 STREET,,,ADDRESS,NEW YORK,,,Pending,07/16/2015 05:59:57 PM,The Department of Health and Mental Hygiene has received and processed your complaint.  All restaurants and mobile food vendors are inspected annually.  Restaurant inspection results can be found on WWW.NYC.GOV or a copy of the inspection can be requested from 311.,06/10/2015 10:34:20 AM,10 MANHATTAN,1017230001.0,MANHATTAN,999388.0,233653.0,PHONE,Unspecified,MANHATTAN,,,,,,,,40.807986393932744,-73.94531695125801,"(40.80798639393274, -73.94531695125801)",True,False,False
30809682,06/09/2015 05:53:29 PM,06/10/2015 06:04:06 PM,DCA,Department of Consumer Affairs,Consumer Complaint,Damaged/Defective Goods,,10027,304 LENOX AVENUE,LENOX AVENUE,WEST 125 STREET,WEST 126 STREET,,,ADDRESS,NEW YORK,,,Closed,06/13/2015 05:53:29 PM,The Department of Consumer Affairs has determined that this issue is not within its jurisdiction. It has been referred to the New York Police Department.,06/10/2015 06:04:06 PM,10 MANHATTAN,1017230001.0,MANHATTAN,999388.0,233653.0,PHONE,Unspecified,MANHATTAN,,,,,,,,40.807986393932744,-73.94531695125801,"(40.80798639393274, -73.94531695125801)",True,False,False
31971823,11/13/2015 02:47:34 PM,11/18/2015 10:29:25 AM,DOT,Department of Transportation,Street Sign - Damaged,"No Parking, Standing, Stopping",Street,10027,304 LENOX AVENUE,LENOX AVENUE,WEST 125 STREET,WEST 126 STREET,,,ADDRESS,NEW YORK,,,Closed,11/30/2015 06:41:12 AM,The Department of Transportation has completed the request or corrected the condition.,11/18/2015 10:29:25 AM,10 MANHATTAN,1017230001.0,MANHATTAN,999388.0,233653.0,PHONE,Unspecified,MANHATTAN,,,,,,,,40.807986393932744,-73.94531695125801,"(40.80798639393274, -73.94531695125801)",False,False,False
33976691,07/31/2016 09:34:25 AM,07/31/2016 09:41:37 AM,DHS,Operations Unit - Department of Homeless Services,Homeless Person Assistance,,Street/Sidewalk,10027.0,304 LENOX AVENUE,LENOX AVENUE,WEST 125 STREET,WEST 126 STREET,,,ADDRESS,NEW YORK,,,Closed,07/31/2016 10:34:25 AM,The mobile outreach response team went to the location provided but could not find the individual that you reported.,07/31/2016 09:41:37 AM,10 MANHATTAN,1017230001.0,MANHATTAN,999388.0,233653.0,MOBILE,Unspecified,MANHATTAN,,,,,,,,40.807986393932744,-73.94531695125801,"(40.80798639393274, -73.94531695125801)",False,True,False
36004341,04/22/2017 10:22:43 AM,04/22/2017 10:30:03 AM,DHS,Operations Unit - Department of Homeless Services,Homeless Person Assistance,,Street/Sidewalk,10027.0,304 LENOX AVENUE,LENOX AVENUE,WEST 125 STREET,WEST 126 STREET,,,ADDRESS,NEW YORK,,,Closed,04/22/2017 11:22:43 AM,The mobile outreach response team went to the location provided but could not find the individual that you reported.,04/22/2017 10:30:03 AM,10 MANHATTAN,1017230001.0,MANHATTAN,999388.0,233653.0,MOBILE,Unspecified,MANHATTAN,,,,,,,,40.807986393932744,-73.94531695125801,"(40.80798639393274, -73.94531695125801)",False,True,True
