Unique Key,Created Date,Closed Date,Agency,Agency Name,Complaint Type,Descriptor,Location Type,Incident Zip,Incident Address,Street Name,Cross Street 1,Cross Street 2,Intersection Street 1,Intersection Street 2,Address Type,City,Landmark,Facility Type,Status,Due Date,Resolution Description,Resolution Action Updated Date,Community Board,BBL,Borough,X Coordinate (State Plane),Y Coordinate (State Plane),Open Data Channel Type,Park Facility Name,Park Borough,Vehicle Type,Taxi Company Borough,Taxi Pick Up Location,Bridge Highway Name,Bridge Highway Direction,Road Ramp,Bridge Highway Segment,Latitude,Longitude,Location,relevant_infraction,preceding_year,preceding_month
16069037,02/23/2010 12:25:55 PM,03/24/2010 12:00:00 AM,DOB,Department of Buildings,Investigations and Discipline (IAD),Electrical - Unlicensed/Illegal/Improper Work In Progress,,10302,350 PORT RICHMOND AVENUE,PORT RICHMOND AVENUE,PALMER AVENUE,HATFIELD PLACE,,,ADDRESS,STATEN ISLAND,,,Closed,,The Department of Buildings investigated this complaint and determined that no further action was necessary.,03/24/2010 12:00:00 AM,01 STATEN ISLAND,5010910032.0,STATEN ISLAND,946315.0,170007.0,UNKNOWN,Unspecified,STATEN ISLAND,,,,,,,,40.63322527705742,-74.13667391983134,"(40.63322527705742, -74.13667391983135)",True,False,False
16199403,03/12/2010 08:18:47 AM,03/12/2010 08:18:47 AM,DOB,Department of Buildings,Investigations and Discipline (IAD),Plumbing Work - Unlicensed/Illegal/Improper Work In Progress,,10302,350 PORT RICHMOND AVENUE,PORT RICHMOND AVENUE,PALMER AVENUE,HATFIELD PLACE,,,ADDRESS,STATEN ISLAND,,,Closed,,The Department of Buildings investigated this complaint and issued an Environmental Control Board violation.,03/12/2010 12:00:00 AM,01 STATEN ISLAND,5010910032.0,STATEN ISLAND,946315.0,170007.0,UNKNOWN,Unspecified,STATEN ISLAND,,,,,,,,40.63322527705742,-74.13667391983134,"(40.63322527705742, -74.13667391983135)",True,False,False
16295195,03/24/2010 10:56:14 AM,04/13/2010 12:00:00 AM,DOB,Department of Buildings,Electrical,Electrical Wiring Defective/Exposed,,10302,350 PORT RICHMOND AVENUE,PORT RICHMOND AVENUE,PALMER AVENUE,HATFIELD PLACE,,,ADDRESS,STATEN ISLAND,,,Closed,,The Department of Buildings investigated this complaint and issued a violation.,04/13/2010 12:00:00 AM,01 STATEN ISLAND,5010910032.0,STATEN ISLAND,946315.0,170007.0,UNKNOWN,Unspecified,STATEN ISLAND,,,,,,,,40.63322527705742,-74.13667391983134,"(40.63322527705742, -74.13667391983135)",True,False,False
16418499,04/09/2010 07:00:00 AM,04/10/2010 09:39:00 AM,DOT,Department of Transportation,Street Condition,Pothole,,10302,350 PORT RICHMOND AVENUE,PORT RICHMOND AVENUE,HATFIELD PLACE,PALMER AVENUE,,,ADDRESS,STATEN ISLAND,,,Closed,,The Department of Transportation inspected this complaint and repaired the problem.,04/10/2010 09:39:00 AM,Unspecified STATEN ISLAND,5010910032.0,STATEN ISLAND,946315.0,170007.0,UNKNOWN,Unspecified,STATEN ISLAND,,,,,,,,40.63322527705742,-74.13667391983134,"(40.63322527705742, -74.13667391983135)",False,False,False
21358597,09/02/2011 09:13:00 AM,09/07/2011 12:00:00 PM,DSNY,BCC - Staten Island,Litter Basket / Request,10 Litter Basket / Request,Sidewalk,10302,350 PORT RICHMOND AVENUE,PORT RICHMOND AVENUE,PALMER AVENUE,HATFIELD PLACE,,,ADDRESS,STATEN ISLAND,,DSNY Garage,Closed,,"The Department of Sanitation has investigated the complaint and addressed the issue. If the problem persists, call 311 to enter a new complaint. If you are outside of New York City, please call (212) NEW-YORK (212-639-9675).",09/07/2011 12:00:00 PM,01 STATEN ISLAND,5010910032.0,STATEN ISLAND,946315.0,170007.0,PHONE,Unspecified,STATEN ISLAND,,,,,,,,40.63322527705742,-74.13667391983134,"(40.63322527705742, -74.13667391983135)",False,False,False
21456693,09/16/2011 03:24:39 PM,10/02/2011 01:06:37 AM,DCA,Department of Consumer Affairs,Consumer Complaint,False Advertising,,10302,350 PORT RICHMOND AVENUE,PORT RICHMOND AVENUE,PALMER AVENUE,HATFIELD PLACE,,,ADDRESS,STATEN ISLAND,,,Closed,10/04/2011 03:11:32 PM,"The Department of Consumer Affairs mailed you a complaint form. If you received the form and have not yet completed it, please do so. Be sure to follow the instructions on the form and return it to DCA with all required documentation.     311 can assist those who have not received the complaint form by creating a new Service Request. Additionally, 311 can assist those who returned the form but want to inquire about the status of the filed complaint.",10/02/2011 01:06:37 AM,01 STATEN ISLAND,5010910032.0,STATEN ISLAND,946315.0,170007.0,ONLINE,Unspecified,STATEN ISLAND,,,,,,,,40.63322527705742,-74.13667391983134,"(40.63322527705742, -74.13667391983135)",True,False,False
24947182,02/06/2013 06:58:08 AM,06/27/2013 12:00:00 AM,DOB,Department of Buildings,Plumbing,Sprinkler System - Inadequate,,10302.0,350 PORT RICHMOND AVENUE,PORT RICHMOND AVENUE,PALMER AVENUE,HATFIELD PLACE,,,ADDRESS,STATEN ISLAND,,,Closed,,The Department of Buildings investigated this complaint and determined that no further action was necessary.,06/27/2013 12:00:00 AM,01 STATEN ISLAND,5010910032.0,STATEN ISLAND,946315.0,170007.0,UNKNOWN,Unspecified,STATEN ISLAND,,,,,,,,40.63322527705742,-74.13667391983134,"(40.63322527705742, -74.13667391983135)",True,True,False
