Unique Key,Created Date,Closed Date,Agency,Agency Name,Complaint Type,Descriptor,Location Type,Incident Zip,Incident Address,Street Name,Cross Street 1,Cross Street 2,Intersection Street 1,Intersection Street 2,Address Type,City,Landmark,Facility Type,Status,Due Date,Resolution Description,Resolution Action Updated Date,Community Board,BBL,Borough,X Coordinate (State Plane),Y Coordinate (State Plane),Open Data Channel Type,Park Facility Name,Park Borough,Vehicle Type,Taxi Company Borough,Taxi Pick Up Location,Bridge Highway Name,Bridge Highway Direction,Road Ramp,Bridge Highway Segment,Latitude,Longitude,Location,relevant_infraction,preceding_year,preceding_month
27619982,03/12/2014 05:15:15 PM,03/12/2014 05:33:13 PM,NYPD,New York City Police Department,Drinking,Underage - Licensed Est,Club/Bar/Restaurant,11355.0,42-06 COLLEGE POINT BOULEVARD,COLLEGE POINT BOULEVARD,SANFORD AVENUE,MAPLE AVENUE,,,ADDRESS,FLUSHING,,Precinct,Closed,03/13/2014 01:15:15 AM,The Police Department reviewed your complaint and provided additional information below.,03/12/2014 05:33:13 PM,07 QUEENS,,QUEENS,1030498.0,214211.0,ONLINE,Unspecified,QUEENS,,,,,,,,40.75451527865884,-73.83307220635461,"(40.75451527865884, -73.83307220635461)",True,False,False
27622204,03/12/2014 11:02:36 AM,03/12/2014 11:16:12 AM,NYPD,New York City Police Department,Noise - Commercial,Loud Music/Party,Club/Bar/Restaurant,11355.0,42-06 COLLEGE POINT BOULEVARD,COLLEGE POINT BOULEVARD,SANFORD AVENUE,MAPLE AVENUE,,,ADDRESS,FLUSHING,,Precinct,Closed,03/12/2014 07:02:36 PM,The Police Department responded to the complaint and determined that police action was not necessary.,03/12/2014 11:16:12 AM,07 QUEENS,,QUEENS,1030498.0,214211.0,ONLINE,Unspecified,QUEENS,,,,,,,,40.75451527865884,-73.83307220635461,"(40.75451527865884, -73.83307220635461)",True,False,False
29134291,06/19/2014 04:15:59 PM,06/24/2014 12:00:00 AM,DOB,Department of Buildings,Building/Use,Illegal Conversion Of Residential Building/Space,,11355.0,42-06 COLLEGE POINT BOULEVARD,COLLEGE POINT BOULEVARD,SANFORD AVENUE,MAPLE AVENUE,,,ADDRESS,Flushing,,,Assigned,,"The Department of Buildings attempted to investigate this complaint but the address was invalid. If the problem still exists, please call 311 and file a new complaint with the correct address. If you are outside of New York City, please call (212) NEW-YORK (212-639-9675).",06/24/2014 12:00:00 AM,07 QUEENS,4050650009.0,QUEENS,1030498.0,214211.0,UNKNOWN,Unspecified,QUEENS,,,,,,,,40.75451527865884,-73.83307220635461,"(40.75451527865884, -73.83307220635461)",True,False,False
30128531,03/08/2015 06:29:45 PM,,DOHMH,Department of Health and Mental Hygiene,Smoking,Smoking Violation,Restaurant/Bar/Deli/Bakery,11355.0,42-06 COLLEGE POINT BOULEVARD,COLLEGE POINT BOULEVARD,SANFORD AVENUE,MAPLE AVENUE,,,ADDRESS,FLUSHING,,,Assigned,04/14/2015 06:29:45 PM,"The Department of Health and Mental Hygiene has sent official written notification to the Owner/Landlord warning them of potential violations and instructing them to correct the situation.  If the situation persists 21 days after your initial complaint, please make a new complaint.",03/09/2015 04:39:26 PM,07 QUEENS,4050650009.0,QUEENS,1030498.0,214211.0,ONLINE,Unspecified,QUEENS,,,,,,,,40.75451527865884,-73.83307220635461,"(40.75451527865884, -73.83307220635461)",True,True,False
28060802,05/16/2014 09:30:31 PM,06/01/2014 01:07:32 AM,DCA,Department of Consumer Affairs,Consumer Complaint,Exchange/Refund/Return,,11355.0,42-06 COLLEGE POINT BOULEVARD,COLLEGE POINT BOULEVARD,SANFORD AVENUE,MAPLE AVENUE,,,ADDRESS,FLUSHING,,,Closed,06/04/2014 12:33:28 PM,"The Department of Consumer Affairs mailed you a complaint form. If you received the form and have not yet completed it, please do so. Be sure to follow the instructions on the form and return it to DCA with all required documentation.     311 can assist those who have not received the complaint form by creating a new Service Request. Additionally, 311 can assist those who returned the form but want to inquire about the status of the filed complaint.",06/01/2014 01:07:32 AM,07 QUEENS,,QUEENS,1030498.0,214211.0,PHONE,Unspecified,QUEENS,,,,,,,,40.75451527865884,-73.83307220635461,"(40.75451527865884, -73.83307220635461)",True,False,False
28505624,07/18/2014 06:12:36 PM,07/21/2014 05:52:16 AM,DPR,Department of Parks and Recreation,Overgrown Tree/Branches,Hitting Building,Street,11355.0,42-06 COLLEGE POINT BOULEVARD,COLLEGE POINT BOULEVARD,SANFORD AVENUE,MAPLE AVENUE,,,ADDRESS,FLUSHING,,,Closed,07/26/2014 06:12:36 PM,The condition was inspected and it was determined that no work order was necessary. The condition will not be inspected again for at least 90 days.,07/21/2014 05:52:16 AM,07 QUEENS,,QUEENS,1030498.0,214211.0,PHONE,Unspecified,QUEENS,,,,,,,,40.75451527865884,-73.83307220635461,"(40.75451527865884, -73.83307220635461)",False,False,False
32031313,11/20/2015 08:47:04 PM,11/20/2015 08:49:44 PM,3-1-1,3-1-1 Call Center,City Vehicle Placard Complaint,,Roadway,11355,42-06 COLLEGE POINT BOULEVARD,COLLEGE POINT BOULEVARD,SANFORD AVENUE,MAPLE AVENUE,,,ADDRESS,FLUSHING,,,Closed,,Thank you for your report.  Your report will be investigated.  No further information will be available from 311 on your individual report.,,07 QUEENS,4050650009.0,QUEENS,1030498.0,214211.0,PHONE,Unspecified,QUEENS,,,,,,,,40.75451527865884,-73.83307220635461,"(40.75451527865884, -73.83307220635461)",False,True,False
32225255,12/17/2015 10:50:49 PM,02/01/2017 12:00:00 AM,DOB,Department of Buildings,Special Projects Inspection Team (SPIT),Advertising Sign/Billboard/Posters/Flexible Fabric - Illegal,,11355,42-06 COLLEGE POINT BOULEVARD,COLLEGE POINT BOULEVARD,,,,,ADDRESS,Flushing,,,Closed,,The Department of Buildings investigated this complaint and determined that no further action was necessary.,02/01/2017 12:00:00 AM,07 QUEENS,4050650009.0,QUEENS,1030498.0,214211.0,UNKNOWN,Unspecified,QUEENS,,,,,,,,40.75451527865884,-73.83307220635461,"(40.75451527865884, -73.83307220635461)",True,True,False
16857461,06/14/2010 07:20:05 PM,06/21/2010 03:19:56 PM,DOT,Department of Transportation,Street Condition,Defective Hardware,Street,11355,42-06 COLLEGE POINT BOULEVARD,COLLEGE POINT BOULEVARD,SANFORD AVENUE,MAPLE AVENUE,,,ADDRESS,FLUSHING,,,Closed,06/24/2010 07:20:05 PM,,06/21/2010 12:00:00 AM,07 QUEENS,,QUEENS,1030498.0,214211.0,PHONE,Unspecified,QUEENS,,,,,,,,40.75451527865884,-73.83307220635461,"(40.75451527865884, -73.83307220635461)",False,False,False
