Unique Key,Created Date,Closed Date,Agency,Agency Name,Complaint Type,Descriptor,Location Type,Incident Zip,Incident Address,Street Name,Cross Street 1,Cross Street 2,Intersection Street 1,Intersection Street 2,Address Type,City,Landmark,Facility Type,Status,Due Date,Resolution Description,Resolution Action Updated Date,Community Board,BBL,Borough,X Coordinate (State Plane),Y Coordinate (State Plane),Open Data Channel Type,Park Facility Name,Park Borough,Vehicle Type,Taxi Company Borough,Taxi Pick Up Location,Bridge Highway Name,Bridge Highway Direction,Road Ramp,Bridge Highway Segment,Latitude,Longitude,Location,relevant_infraction,preceding_year,preceding_month
23349622,06/02/2012 05:39:00 PM,07/18/2012 11:15:00 AM,DEP,Department of Environmental Protection,Air Quality,"Air: Odor/Fumes, Restaurant (AD2)",,10463.0,5588 BROADWAY,BROADWAY,W 231 ST,NAPLES TER,,,ADDRESS,BRONX,,,Closed,,"The Department of Environmental Protection did not observe a violation of the New York City Air/Noise Code at the time of inspection and could not issue a notice of violation. If the problem still exists, please call 311 and file a new complaint. If you are outside of New York City, please call (212) NEW-YORK (212-639-9675).",07/18/2012 11:15:00 AM,08 BRONX,2032670084.0,BRONX,1010632.0,259599.0,ONLINE,Unspecified,BRONX,,,,,,,,40.879174099143526,-73.9045981618307,"(40.879174099143526, -73.9045981618307)",False,True,False
16724320,05/24/2010 05:36:51 PM,05/24/2010 05:36:51 PM,DOB,Department of Buildings,Building/Use,No Certificate Of Occupancy/Illegal/Contrary To CO,,10463,5588 BROADWAY,BROADWAY,WEST 231 STREET,NAPLES TERRACE,,,ADDRESS,BRONX,,,Open,,Your Service Request has been submitted to the Department of Buildings.  Please check back later for status.,05/24/2010 12:00:00 AM,08 BRONX,2032670084.0,BRONX,1010635.0,259605.0,UNKNOWN,Unspecified,BRONX,,,,,,,,40.879190558304614,-73.90458728969176,"(40.87919055830462, -73.90458728969176)",True,False,False
16709317,05/21/2010 04:41:12 PM,05/22/2010 12:00:00 AM,DOB,Department of Buildings,Building/Use,SRO - Illegal Work/No Permit/Change In Occupancy/Use,,10463,5588 BROADWAY,BROADWAY,WEST 231 STREET,NAPLES TERRACE,,,ADDRESS,BRONX,,,Closed,,The Department of Buildings investigated this complaint and issued an Environmental Control Board violation.,05/22/2010 12:00:00 AM,08 BRONX,2032670084.0,BRONX,1010635.0,259605.0,UNKNOWN,Unspecified,BRONX,,,,,,,,40.879190558304614,-73.90458728969176,"(40.87919055830462, -73.90458728969176)",True,False,False
18932288,10/19/2010 12:34:34 PM,10/19/2010 12:34:34 PM,DOB,Department of Buildings,Building/Use,No Certificate Of Occupancy/Illegal/Contrary To CO,,10463,5588 BROADWAY,BROADWAY,WEST 231 STREET,NAPLES TERRACE,,,ADDRESS,BRONX,,,Closed,,The Department of Buildings investigated this complaint and issued an Environmental Control Board violation.,10/19/2010 12:00:00 AM,08 BRONX,2032670084.0,BRONX,1010635.0,259605.0,UNKNOWN,Unspecified,BRONX,,,,,,,,40.879190558304614,-73.90458728969176,"(40.87919055830462, -73.90458728969176)",True,False,False
23317598,05/29/2012 11:18:33 AM,06/13/2012 09:28:32 AM,DOT,Department of Transportation,Broken Muni Meter,No Receipt,Street,10463,5588 BROADWAY,BROADWAY,WEST 231 STREET,NAPLES TERRACE,,,ADDRESS,BRONX,,,Closed,06/12/2012 11:18:33 AM,"The condition has been inspected/investigated, see customer notes for more information.",06/13/2012 09:28:32 AM,08 BRONX,2032670084.0,BRONX,1010635.0,259605.0,PHONE,Unspecified,BRONX,,,,,,,,40.879190558304614,-73.90458728969176,"(40.87919055830462, -73.90458728969176)",False,True,False
24703240,01/02/2013 01:25:52 PM,01/25/2013 05:32:00 AM,DOT,Department of Transportation,Broken Muni Meter,No Receipt,Street,10463,5588 BROADWAY,BROADWAY,WEST 231 STREET,NAPLES TERRACE,,,ADDRESS,BRONX,,,Closed,01/23/2013 01:25:52 PM,"The Department of Transportation inspected the condition you reported. You can find additional information in the ""Notes to Customer"" field.",01/25/2013 05:32:00 AM,08 BRONX,2032670084.0,BRONX,1010635.0,259605.0,PHONE,Unspecified,BRONX,,,,,,,,40.879190558304614,-73.90458728969176,"(40.87919055830462, -73.90458728969176)",False,True,False
